{
  "version": "1.0.0",
  "default_locale": "zh",
  "prompts": {
    "conversation_start": {
      "content": "",
      "description": "对话开始时的欢迎提示",
      "variables": [],
      "category": "conversation",
      "enabled": true,
      "version": "1.0.0",
      "tags": ["welcome", "conversation"]
    },
    "conversation_continue": {
      "content": "",
      "description": "继续对话时的上下文提示",
      "variables": ["previous_context"],
      "category": "conversation",
      "enabled": true,
      "version": "1.0.0",
      "tags": ["continue", "context"]
    }
  },
  "metadata": {
    "created": "2025-06-16T08:30:00.000Z",
    "updated": "2025-06-16T08:30:00.000Z",
    "author": "System",
    "description": "Conversation-related prompt templates"
  }
} 